{
  "schema_version": 1,
  "commit": {
    "sha": "7155093a6afad023d8e5c529e25db0aedc84da51",
    "parents": [
      "172b43a5591c2d7fe98028207e48fbdf7b09b0b2"
    ],
    "timestamp": 1770386669,
    "branch": "feature/ai-first-integration"
  },
  "analysis": {
    "scope": "full",
    "tool_version": "0.0.1"
  },
  "functions": [
    {
      "function_id": "/Users/stephencollins/projects/stephencollins.tech-repos/faultline/tests/fixtures/js/loop-breaks.js::loopWithBreaks",
      "file": "/Users/stephencollins/projects/stephencollins.tech-repos/faultline/tests/fixtures/js/loop-breaks.js",
      "line": 2,
      "metrics": {
        "cc": 8,
        "nd": 2,
        "fo": 0,
        "ns": 2
      },
      "lrs": 6.169925001442312,
      "band": "high"
    },
    {
      "function_id": "/Users/stephencollins/projects/stephencollins.tech-repos/faultline/tests/fixtures/js/nested-branching.js::nested",
      "file": "/Users/stephencollins/projects/stephencollins.tech-repos/faultline/tests/fixtures/js/nested-branching.js",
      "line": 2,
      "metrics": {
        "cc": 8,
        "nd": 2,
        "fo": 0,
        "ns": 4
      },
      "lrs": 7.569925001442312,
      "band": "high"
    },
    {
      "function_id": "/Users/stephencollins/projects/stephencollins.tech-repos/faultline/tests/fixtures/js/pathological.js::pathological",
      "file": "/Users/stephencollins/projects/stephencollins.tech-repos/faultline/tests/fixtures/js/pathological.js",
      "line": 2,
      "metrics": {
        "cc": 20,
        "nd": 6,
        "fo": 0,
        "ns": 3
      },
      "lrs": 11.29231742277876,
      "band": "critical"
    },
    {
      "function_id": "/Users/stephencollins/projects/stephencollins.tech-repos/faultline/tests/fixtures/js/simple.js::simple",
      "file": "/Users/stephencollins/projects/stephencollins.tech-repos/faultline/tests/fixtures/js/simple.js",
      "line": 2,
      "metrics": {
        "cc": 1,
        "nd": 0,
        "fo": 0,
        "ns": 0
      },
      "lrs": 1.0,
      "band": "low"
    },
    {
      "function_id": "/Users/stephencollins/projects/stephencollins.tech-repos/faultline/tests/fixtures/js/try-catch-finally.js::tryCatchFinally",
      "file": "/Users/stephencollins/projects/stephencollins.tech-repos/faultline/tests/fixtures/js/try-catch-finally.js",
      "line": 2,
      "metrics": {
        "cc": 10,
        "nd": 2,
        "fo": 0,
        "ns": 1
      },
      "lrs": 5.759431618637298,
      "band": "moderate"
    },
    {
      "function_id": "/Users/stephencollins/projects/stephencollins.tech-repos/faultline/tests/fixtures/jsx/complex-component.jsx::<anonymous>",
      "file": "/Users/stephencollins/projects/stephencollins.tech-repos/faultline/tests/fixtures/jsx/complex-component.jsx",
      "line": 3,
      "metrics": {
        "cc": 9,
        "nd": 3,
        "fo": 1,
        "ns": 2
      },
      "lrs": 7.721928094887362,
      "band": "high"
    },
    {
      "function_id": "/Users/stephencollins/projects/stephencollins.tech-repos/faultline/tests/fixtures/jsx/complex-component.jsx::<anonymous>",
      "file": "/Users/stephencollins/projects/stephencollins.tech-repos/faultline/tests/fixtures/jsx/complex-component.jsx",
      "line": 20,
      "metrics": {
        "cc": 1,
        "nd": 0,
        "fo": 1,
        "ns": 0
      },
      "lrs": 1.6,
      "band": "low"
    },
    {
      "function_id": "/Users/stephencollins/projects/stephencollins.tech-repos/faultline/tests/fixtures/jsx/complex-component.jsx::<anonymous>",
      "file": "/Users/stephencollins/projects/stephencollins.tech-repos/faultline/tests/fixtures/jsx/complex-component.jsx",
      "line": 21,
      "metrics": {
        "cc": 1,
        "nd": 0,
        "fo": 1,
        "ns": 0
      },
      "lrs": 1.6,
      "band": "low"
    },
    {
      "function_id": "/Users/stephencollins/projects/stephencollins.tech-repos/faultline/tests/fixtures/jsx/complex-component.jsx::ComplexComponent",
      "file": "/Users/stephencollins/projects/stephencollins.tech-repos/faultline/tests/fixtures/jsx/complex-component.jsx",
      "line": 2,
      "metrics": {
        "cc": 3,
        "nd": 3,
        "fo": 3,
        "ns": 2
      },
      "lrs": 7.0,
      "band": "high"
    },
    {
      "function_id": "/Users/stephencollins/projects/stephencollins.tech-repos/faultline/tests/fixtures/jsx/conditional-rendering.jsx::ConditionalComponent",
      "file": "/Users/stephencollins/projects/stephencollins.tech-repos/faultline/tests/fixtures/jsx/conditional-rendering.jsx",
      "line": 2,
      "metrics": {
        "cc": 2,
        "nd": 0,
        "fo": 0,
        "ns": 0
      },
      "lrs": 1.584962500721156,
      "band": "low"
    },
    {
      "function_id": "/Users/stephencollins/projects/stephencollins.tech-repos/faultline/tests/fixtures/jsx/simple-component.jsx::SimpleComponent",
      "file": "/Users/stephencollins/projects/stephencollins.tech-repos/faultline/tests/fixtures/jsx/simple-component.jsx",
      "line": 2,
      "metrics": {
        "cc": 1,
        "nd": 0,
        "fo": 0,
        "ns": 0
      },
      "lrs": 1.0,
      "band": "low"
    },
    {
      "function_id": "/Users/stephencollins/projects/stephencollins.tech-repos/faultline/tests/fixtures/loop-breaks.ts::loopWithBreaks",
      "file": "/Users/stephencollins/projects/stephencollins.tech-repos/faultline/tests/fixtures/loop-breaks.ts",
      "line": 2,
      "metrics": {
        "cc": 8,
        "nd": 2,
        "fo": 0,
        "ns": 2
      },
      "lrs": 6.169925001442312,
      "band": "high"
    },
    {
      "function_id": "/Users/stephencollins/projects/stephencollins.tech-repos/faultline/tests/fixtures/nested-branching.ts::nested",
      "file": "/Users/stephencollins/projects/stephencollins.tech-repos/faultline/tests/fixtures/nested-branching.ts",
      "line": 2,
      "metrics": {
        "cc": 8,
        "nd": 2,
        "fo": 0,
        "ns": 4
      },
      "lrs": 7.569925001442312,
      "band": "high"
    },
    {
      "function_id": "/Users/stephencollins/projects/stephencollins.tech-repos/faultline/tests/fixtures/pathological.ts::pathological",
      "file": "/Users/stephencollins/projects/stephencollins.tech-repos/faultline/tests/fixtures/pathological.ts",
      "line": 2,
      "metrics": {
        "cc": 20,
        "nd": 6,
        "fo": 0,
        "ns": 3
      },
      "lrs": 11.29231742277876,
      "band": "critical"
    },
    {
      "function_id": "/Users/stephencollins/projects/stephencollins.tech-repos/faultline/tests/fixtures/simple.ts::simple",
      "file": "/Users/stephencollins/projects/stephencollins.tech-repos/faultline/tests/fixtures/simple.ts",
      "line": 2,
      "metrics": {
        "cc": 1,
        "nd": 0,
        "fo": 0,
        "ns": 0
      },
      "lrs": 1.0,
      "band": "low"
    },
    {
      "function_id": "/Users/stephencollins/projects/stephencollins.tech-repos/faultline/tests/fixtures/try-catch-finally.ts::tryCatchFinally",
      "file": "/Users/stephencollins/projects/stephencollins.tech-repos/faultline/tests/fixtures/try-catch-finally.ts",
      "line": 2,
      "metrics": {
        "cc": 10,
        "nd": 2,
        "fo": 0,
        "ns": 1
      },
      "lrs": 5.759431618637298,
      "band": "moderate"
    },
    {
      "function_id": "/Users/stephencollins/projects/stephencollins.tech-repos/faultline/tests/fixtures/tsx/complex-component.tsx::<anonymous>",
      "file": "/Users/stephencollins/projects/stephencollins.tech-repos/faultline/tests/fixtures/tsx/complex-component.tsx",
      "line": 3,
      "metrics": {
        "cc": 9,
        "nd": 3,
        "fo": 1,
        "ns": 2
      },
      "lrs": 7.721928094887362,
      "band": "high"
    },
    {
      "function_id": "/Users/stephencollins/projects/stephencollins.tech-repos/faultline/tests/fixtures/tsx/complex-component.tsx::<anonymous>",
      "file": "/Users/stephencollins/projects/stephencollins.tech-repos/faultline/tests/fixtures/tsx/complex-component.tsx",
      "line": 20,
      "metrics": {
        "cc": 1,
        "nd": 0,
        "fo": 1,
        "ns": 0
      },
      "lrs": 1.6,
      "band": "low"
    },
    {
      "function_id": "/Users/stephencollins/projects/stephencollins.tech-repos/faultline/tests/fixtures/tsx/complex-component.tsx::<anonymous>",
      "file": "/Users/stephencollins/projects/stephencollins.tech-repos/faultline/tests/fixtures/tsx/complex-component.tsx",
      "line": 21,
      "metrics": {
        "cc": 1,
        "nd": 0,
        "fo": 1,
        "ns": 0
      },
      "lrs": 1.6,
      "band": "low"
    },
    {
      "function_id": "/Users/stephencollins/projects/stephencollins.tech-repos/faultline/tests/fixtures/tsx/complex-component.tsx::ComplexComponent",
      "file": "/Users/stephencollins/projects/stephencollins.tech-repos/faultline/tests/fixtures/tsx/complex-component.tsx",
      "line": 2,
      "metrics": {
        "cc": 3,
        "nd": 3,
        "fo": 3,
        "ns": 2
      },
      "lrs": 7.0,
      "band": "high"
    },
    {
      "function_id": "/Users/stephencollins/projects/stephencollins.tech-repos/faultline/tests/fixtures/tsx/conditional-rendering.tsx::ConditionalComponent",
      "file": "/Users/stephencollins/projects/stephencollins.tech-repos/faultline/tests/fixtures/tsx/conditional-rendering.tsx",
      "line": 2,
      "metrics": {
        "cc": 2,
        "nd": 0,
        "fo": 0,
        "ns": 0
      },
      "lrs": 1.584962500721156,
      "band": "low"
    },
    {
      "function_id": "/Users/stephencollins/projects/stephencollins.tech-repos/faultline/tests/fixtures/tsx/simple-component.tsx::SimpleComponent",
      "file": "/Users/stephencollins/projects/stephencollins.tech-repos/faultline/tests/fixtures/tsx/simple-component.tsx",
      "line": 2,
      "metrics": {
        "cc": 1,
        "nd": 0,
        "fo": 0,
        "ns": 0
      },
      "lrs": 1.0,
      "band": "low"
    }
  ]
}